{
  "$schema": "https://json-schema.org/draft/2020-12/schema",
  "$id": "https://gobl.org/draft-0/tax/regime-def",
  "$ref": "#/$defs/tax.RegimeDef",
  "$defs": {
    "tax.CategoryDef": {
      "properties": {
        "code": {
          "$ref": "https://gobl.org/draft-0/cbc/code",
          "title": "Code",
          "description": "Code to be used in documents."
        },
        "name": {
          "$ref": "https://gobl.org/draft-0/i18n/string",
          "title": "Name",
          "description": "Short name of the category to be used instead of the code in output."
        },
        "title": {
          "$ref": "https://gobl.org/draft-0/i18n/string",
          "title": "Title",
          "description": "Human readable name of the category used for titles."
        },
        "desc": {
          "$ref": "https://gobl.org/draft-0/i18n/string",
          "title": "Description",
          "description": "Useful description of the category."
        },
        "retained": {
          "type": "boolean",
          "title": "Retained",
          "description": "When true, the tax amount will be retained by the buyer on behalf of the\nsupplier, and thus subtracted from the invoice taxable base total. Typically\nused for taxes related to income."
        },
        "informative": {
          "type": "boolean",
          "title": "Informative",
          "description": "When true, the tax amount will be calculated and reported but will not affect\nthe invoice totals. Typically used for taxes that are embedded in the base\namount or don't impact the final payable amount."
        },
        "keys": {
          "items": {
            "$ref": "#/$defs/tax.KeyDef"
          },
          "type": "array",
          "title": "Keys",
          "description": "Specific tax definitions inside this category."
        },
        "rates": {
          "items": {
            "$ref": "#/$defs/tax.RateDef"
          },
          "type": "array",
          "title": "Rates",
          "description": "Set of rates that can be used with this category."
        },
        "extensions": {
          "items": {
            "$ref": "https://gobl.org/draft-0/cbc/key"
          },
          "type": "array",
          "title": "Extensions",
          "description": "Extension keys that may be used or required as an alternative to or alongside\na rate for the tax category. Every key must be defined in the regime's\nextensions table."
        },
        "map": {
          "$ref": "https://gobl.org/draft-0/cbc/code-map",
          "title": "Map",
          "description": "Regime specific code mappings."
        },
        "sources": {
          "items": {
            "$ref": "https://gobl.org/draft-0/cbc/source"
          },
          "type": "array",
          "title": "Sources",
          "description": "List of sources for the information contained in this category and most importantly,\nan official source where the tax rates can be reviewed and updated in the future."
        },
        "ext": {
          "$ref": "https://gobl.org/draft-0/tax/extensions",
          "title": "Extensions",
          "description": "Extension key-value pairs that will be copied to the tax combo if this\ncategory is used."
        },
        "meta": {
          "$ref": "https://gobl.org/draft-0/cbc/meta",
          "title": "Meta",
          "description": "Additional information about the category that is relevant for local frequently\nused formats."
        }
      },
      "type": "object",
      "required": [
        "code",
        "name"
      ],
      "description": "CategoryDef contains the definition of a general type of tax inside a region."
    },
    "tax.KeyDef": {
      "properties": {
        "key": {
          "$ref": "https://gobl.org/draft-0/cbc/key",
          "title": "Key",
          "description": "Unique identifier for the key within the category."
        },
        "name": {
          "$ref": "https://gobl.org/draft-0/i18n/string",
          "title": "Name",
          "description": "Human readable name of the key."
        },
        "desc": {
          "$ref": "https://gobl.org/draft-0/i18n/string",
          "title": "Description",
          "description": "Useful description of the key."
        },
        "no_percent": {
          "type": "boolean",
          "title": "No Percent",
          "description": "When true, a tax combo using this key should not define a percent value."
        }
      },
      "type": "object",
      "description": "KeyDef defines a key that can be used inside a tax category."
    },
    "tax.RateDef": {
      "properties": {
        "rate": {
          "$ref": "https://gobl.org/draft-0/cbc/key",
          "title": "Rate",
          "description": "Identifies the rate within the category."
        },
        "keys": {
          "items": {
            "$ref": "https://gobl.org/draft-0/cbc/key"
          },
          "type": "array",
          "title": "Keys",
          "description": "Tax keys defined in the category that this rate can be used with."
        },
        "name": {
          "$ref": "https://gobl.org/draft-0/i18n/string",
          "title": "Name",
          "description": "Human readable name of the rate."
        },
        "desc": {
          "$ref": "https://gobl.org/draft-0/i18n/string",
          "title": "Description",
          "description": "Useful description of the rate."
        },
        "values": {
          "items": {
            "$ref": "#/$defs/tax.RateValueDef"
          },
          "type": "array",
          "title": "Values",
          "description": "Current and historical percentage values for the rate with additional filters.\nOrder is important; newer values should come before older values."
        },
        "meta": {
          "$ref": "https://gobl.org/draft-0/cbc/meta",
          "title": "Meta",
          "description": "Additional information about the rate that is relevant for local frequently used\nimplementations."
        }
      },
      "type": "object",
      "required": [
        "rate",
        "name"
      ],
      "description": "RateDef defines a single rate inside a category"
    },
    "tax.RateValueDef": {
      "properties": {
        "ext": {
          "$ref": "https://gobl.org/draft-0/tax/extensions",
          "title": "Extensions",
          "description": "Extension codes used to filter whether this value applies."
        },
        "since": {
          "$ref": "https://gobl.org/draft-0/cal/date",
          "title": "Since",
          "description": "Date from which this value should be applied."
        },
        "percent": {
          "$ref": "https://gobl.org/draft-0/num/percentage",
          "title": "Percent",
          "description": "Percent rate that should be applied."
        },
        "surcharge": {
          "$ref": "https://gobl.org/draft-0/num/percentage",
          "title": "Surcharge",
          "description": "An additional surcharge to apply."
        },
        "disabled": {
          "type": "boolean",
          "title": "Disabled",
          "description": "When true, this value should no longer be used."
        }
      },
      "type": "object",
      "required": [
        "percent"
      ],
      "description": "RateValueDef contains a percentage rate or fixed amount for a given date range."
    },
    "tax.RegimeDef": {
      "properties": {
        "name": {
          "$ref": "https://gobl.org/draft-0/i18n/string",
          "title": "Name",
          "description": "Name of the tax regime."
        },
        "description": {
          "$ref": "https://gobl.org/draft-0/i18n/string",
          "title": "Description",
          "description": "Introductory details about the regime."
        },
        "sources": {
          "items": {
            "$ref": "https://gobl.org/draft-0/cbc/source"
          },
          "type": "array",
          "title": "Sources",
          "description": "References to tax authority or other relevant documentation that can be used to\nvalidate the regime's data and to check for updates and changes in the future."
        },
        "time_zone": {
          "type": "string",
          "title": "Time Zone",
          "description": "Location name for the country's central time zone. Accepted\nvalues from IANA Time Zone Database (https://iana.org/time-zones). If a country has multiple\ntime zones, the most common or central one should be used."
        },
        "country": {
          "$ref": "https://gobl.org/draft-0/l10n/tax-country-code",
          "title": "Code",
          "description": "Country code for tax purposes which usually coincides with the ISO 3166-1 alpha-2 code, but not\nalways."
        },
        "alt_country_codes": {
          "items": {
            "$ref": "https://gobl.org/draft-0/l10n/code"
          },
          "type": "array",
          "title": "Alternative Country Codes",
          "description": "Alternative localization codes that may be used to identify the tax regime\nin specific circumstances."
        },
        "zone": {
          "$ref": "https://gobl.org/draft-0/l10n/code",
          "title": "Zone",
          "description": "Specific Locality, region, city, province, county, or similar code inside\nthe country, if needed."
        },
        "currency": {
          "$ref": "https://gobl.org/draft-0/currency/code",
          "title": "Currency",
          "description": "Currency used by the country."
        },
        "tax_scheme": {
          "$ref": "https://gobl.org/draft-0/cbc/code",
          "title": "Tax Scheme",
          "description": "Principal scheme of consumption tax that applies to the regime and is associated\nwith tax IDs in some export formats such as UBL or CII. Some regimes, like the\nUS, may not have a tax scheme and as a consequence will not use tax identities."
        },
        "calculator_rounding_rule": {
          "$ref": "https://gobl.org/draft-0/cbc/key",
          "title": "Calculator Rounding Rule",
          "description": "Rounding rule to use when calculating the tax totals. See the RoundingRule\nconstants for more details. If not provided, the default is RoundingRulePrecise."
        },
        "tags": {
          "items": {
            "$ref": "https://gobl.org/draft-0/tax/tag-set"
          },
          "type": "array",
          "title": "Tags",
          "description": "Tags that can be applied at the document level to identify additional\nconsiderations."
        },
        "extensions": {
          "items": {
            "$ref": "https://gobl.org/draft-0/cbc/definition"
          },
          "type": "array",
          "title": "Extensions",
          "description": "Keys that can be used for extended or extra data specific to the regime that\ncannot be easily determined from other GOBL structures. Typically used to define\nlocal codes for suppliers, customers, products, or tax rates."
        },
        "identities": {
          "items": {
            "$ref": "https://gobl.org/draft-0/cbc/definition"
          },
          "type": "array",
          "title": "Identities",
          "description": "Identities used in addition to regular tax identities and specific for the\nregime that may be validated against."
        },
        "stamps": {
          "items": {
            "$ref": "https://gobl.org/draft-0/cbc/key"
          },
          "type": "array",
          "title": "Stamps",
          "description": "Keys of the stamps that may be added to documents by the regime's tax\nagency or intermediaries. Definitions are registered in the head package."
        },
        "payment_means_keys": {
          "items": {
            "$ref": "https://gobl.org/draft-0/cbc/definition"
          },
          "type": "array",
          "title": "Payment Means Keys",
          "description": "Payment means keys specific to the regime that extend the base set."
        },
        "inbox_keys": {
          "items": {
            "$ref": "https://gobl.org/draft-0/cbc/definition"
          },
          "type": "array",
          "title": "Inbox Keys",
          "description": "Inbox keys specific to the regime that identify where a document should be\nforwarded to."
        },
        "scenarios": {
          "items": {
            "$ref": "https://gobl.org/draft-0/tax/scenario-set"
          },
          "type": "array",
          "title": "Scenarios",
          "description": "Sets of conditions and rules that apply to a specific document schema. These\nprovide a more generic solution for normalization and validation of documents in\nregimes with specific requirements."
        },
        "corrections": {
          "$ref": "https://gobl.org/draft-0/tax/correction-set",
          "title": "Corrections",
          "description": "Configuration details for corrections to be used with correction options."
        },
        "categories": {
          "items": {
            "$ref": "#/$defs/tax.CategoryDef"
          },
          "type": "array",
          "title": "Categories",
          "description": "List of tax categories."
        }
      },
      "type": "object",
      "required": [
        "name",
        "time_zone",
        "country",
        "currency",
        "categories"
      ],
      "description": "RegimeDef defines the holding structure for the definitions of taxes inside a country or territory."
    }
  }
}