{
  "$schema": "https://gobl.org/draft-0/tax/regime-def",
  "name": {
    "da": "Danmark",
    "en": "Denmark"
  },
  "description": {
    "en": "Denmark's tax system is administered by the Danish Tax Agency (Skattestyrelsen).\nAs an EU member state, Denmark follows the EU VAT Directive.\n\nVAT (Moms, short for Merværdiafgift) applies at a single standard rate on\nmost goods and services. Unlike many other EU countries, Denmark does not\nhave reduced VAT rates, making it one of the simplest VAT systems in Europe.\nCertain supplies are zero-rated (e.g. exports, newspapers) or exempt (e.g.\nhealthcare, education, financial services).\n\nBusinesses are identified by their CVR number (Det Centrale Virksomhedsregister),\nan 8-digit number. The Danish VAT number uses the format DK followed by the\n8-digit CVR number. E-invoicing via the NemHandel/PEPPOL network is mandatory\nfor all B2G transactions."
  },
  "time_zone": "Europe/Copenhagen",
  "country": "DK",
  "currency": "DKK",
  "tax_scheme": "VAT",
  "identities": [
    {
      "code": "CVR",
      "name": {
        "da": "CVR-nummer",
        "en": "CVR Number"
      }
    },
    {
      "code": "CPR",
      "name": {
        "da": "CPR-nummer",
        "en": "CPR Number"
      }
    }
  ],
  "corrections": [
    {
      "schema": "bill/invoice",
      "types": [
        "credit-note"
      ]
    }
  ],
  "categories": [
    {
      "code": "VAT",
      "name": {
        "da": "moms",
        "en": "VAT"
      },
      "title": {
        "da": "Merværdiafgift",
        "en": "Value Added Tax"
      },
      "keys": [
        {
          "key": "standard",
          "name": {
            "en": "Standard"
          }
        },
        {
          "key": "zero",
          "name": {
            "en": "Zero"
          }
        },
        {
          "key": "reverse-charge",
          "name": {
            "en": "Reverse charge"
          },
          "no_percent": true
        },
        {
          "key": "exempt",
          "name": {
            "en": "Exempt"
          },
          "no_percent": true
        },
        {
          "key": "export",
          "name": {
            "en": "Export"
          },
          "no_percent": true
        },
        {
          "key": "intra-community",
          "name": {
            "en": "Intra-community"
          },
          "no_percent": true
        },
        {
          "key": "outside-scope",
          "name": {
            "en": "Outside scope"
          },
          "no_percent": true
        }
      ],
      "rates": [
        {
          "rate": "general",
          "keys": [
            "standard"
          ],
          "name": {
            "da": "Standardsats",
            "en": "General Rate"
          },
          "values": [
            {
              "since": "1992-01-01",
              "percent": "25.0%"
            }
          ]
        }
      ],
      "sources": [
        {
          "title": {
            "en": "Danish Tax Agency - VAT rates"
          },
          "url": "https://skat.dk/erhverv/moms"
        }
      ]
    }
  ]
}