{
  "$schema": "https://gobl.org/draft-0/tax/regime-def",
  "name": {
    "en": "Switzerland"
  },
  "description": {
    "en": "Switzerland's tax system is administered by the Federal Tax Administration\n(Eidgenössische Steuerverwaltung, ESTV). Although not an EU member, Switzerland\noperates its own VAT system (Mehrwertsteuer, MWST).\n\nVAT applies at standard, reduced, and special rates. The reduced rate covers\neveryday goods such as food, non-alcoholic beverages, books, newspapers, and\nmedicines, while a special rate applies to accommodation services.\n\nBusinesses with annual taxable revenues exceeding CHF 100,000 must register\nfor VAT. Tax identification uses the UID (Unternehmens-Identifikationsnummer)\nin the format CHE-XXX.XXX.XXX followed by \"MWST\" for VAT purposes.\n\nSwitzerland supports credit notes for invoice corrections. E-invoicing is not\nmandatory but is increasingly used, particularly in business-to-government (B2G)\ntransactions."
  },
  "time_zone": "Europe/Zurich",
  "country": "CH",
  "currency": "CHF",
  "tax_scheme": "VAT",
  "scenarios": [
    {
      "schema": "bill/invoice",
      "list": [
        {
          "tags": [
            "reverse-charge"
          ],
          "cat": [
            "VAT"
          ],
          "note": {
            "cat": "VAT",
            "key": "reverse-charge",
            "text": "Reverse charge: Customer to account for VAT to the relevant tax authority."
          }
        }
      ]
    }
  ],
  "corrections": [
    {
      "schema": "bill/invoice",
      "types": [
        "credit-note"
      ]
    }
  ],
  "categories": [
    {
      "code": "VAT",
      "name": {
        "en": "VAT"
      },
      "title": {
        "en": "Value Added Tax"
      },
      "keys": [
        {
          "key": "standard",
          "name": {
            "en": "Standard"
          }
        },
        {
          "key": "zero",
          "name": {
            "en": "Zero"
          }
        },
        {
          "key": "reverse-charge",
          "name": {
            "en": "Reverse charge"
          },
          "no_percent": true
        },
        {
          "key": "exempt",
          "name": {
            "en": "Exempt"
          },
          "no_percent": true
        },
        {
          "key": "export",
          "name": {
            "en": "Export"
          },
          "no_percent": true
        },
        {
          "key": "intra-community",
          "name": {
            "en": "Intra-community"
          },
          "no_percent": true
        },
        {
          "key": "outside-scope",
          "name": {
            "en": "Outside scope"
          },
          "no_percent": true
        }
      ],
      "rates": [
        {
          "rate": "general",
          "keys": [
            "standard"
          ],
          "name": {
            "en": "General Rate"
          },
          "desc": {
            "en": "Applies to most goods and services."
          },
          "values": [
            {
              "since": "2024-01-01",
              "percent": "8.1%"
            }
          ]
        },
        {
          "rate": "intermediate",
          "keys": [
            "standard"
          ],
          "name": {
            "en": "Intermediate Rate"
          },
          "desc": {
            "en": "Applies to accommodation services."
          },
          "values": [
            {
              "since": "2024-01-01",
              "percent": "3.8%"
            }
          ]
        },
        {
          "rate": "reduced",
          "keys": [
            "standard"
          ],
          "name": {
            "en": "Reduced Rate"
          },
          "desc": {
            "en": "Applies to food, books, newspapers, and public transport."
          },
          "values": [
            {
              "since": "2024-01-01",
              "percent": "2.6%"
            }
          ]
        }
      ],
      "sources": [
        {
          "title": {
            "en": "Current Swiss VAT rates | FTA"
          },
          "url": "https://www.estv.admin.ch/estv/en/home/value-added-tax/vat-rates-switzerland.html"
        }
      ]
    }
  ]
}